id,address1,address2,latitude,longitude,has_cardomat,is_open,workload,city
27,"мкр. Авангард-3, ул. Владимирского, д. 32","уг. ул. Курмангазы, возле магазина Sulpak",47.0935077204939,51.8780058895487,True,True,"{'text': 'Ожидание до 10 мин', 'type': 'low'}",Атырау
31,"пр. Ауэзова, д. 56","возле ТД Сауран, ост. ""Школа""",47.0890123051618,51.9092458012572,False,True,"{'text': 'Ожидание до 10 мин', 'type': 'low'}",Атырау
30,"ул. Баймуханова, д. 3, кв. 52","напротив ТЦ Стамбул Үй Әлемі, рядом c рынком Мурагер, ост. ""Привокзальная""",47.1294,51.9457,False,True,"{'text': 'Ожидание до 10 мин', 'type': 'low'}",Атырау
25,"ул. Баймуханова, д. 66Б","уг. ул. Сатыбалдиева, ТД Лимон, рядом с ж/д вокзалом",47.12836,51.957529,True,True,"{'text': 'Ожидание до 30 мин', 'type': 'medium'}",Атырау
29,"ул. М.Утемисова, д. 98","уг. ул. Абая, рядом с пассажем ""Насиха""",47.1039,51.9285,True,True,"{'text': 'Ожидание до 30 мин', 'type': 'medium'}",Атырау
28,"ул. Сатпаева, д. 32, кв. 67","уг. ул. Тайманова, в р-не площади Исатая-Махамбета",47.104819,51.90397,True,True,"{'text': 'Ожидание свыше 30 мин', 'type': 'high'}",Атырау
32,"ул. С.Датова, д. 11","уг. ул. Махамбета, возле ТД Арын, напротив АЗС Helios",47.0968783274115,51.9279399140155,True,True,"{'text': 'Ожидание до 30 мин', 'type': 'medium'}",Атырау
