id,address1,address2,latitude,longitude,status,city
42580,"мкр. Нуркент, д. 57",ТД Nurkent,43.2538,76.8207,"{'is_working': True, 'additional_info': []}",Алматы
112984,"мкр. Ожет, ул. Бекболата, д. 2/91","рынок ""УЖЕТ"", северный вход, мебельный павильон",43.3084,76.8947,"{'is_working': True, 'additional_info': []}",Алматы
40978,"мкр. Орбита-1, д. 2, по ул. Навои, уг. ул. Торайгырова","магазин ""ASAR""",43.2021,76.8856,"{'is_working': True, 'additional_info': []}",Алматы
112899,"мкр. Орбита- 2, д. 29","ул. Биржана, уг. ул. Мустафина, магазин ""Шарайна""",43.1985467063681,76.8820251404202,"{'is_working': True, 'additional_info': []}",Алматы
110325,"мкр. Орбита--2, д. 6, Н 1","ул. Навои, уг. пр. Аль-Фараби, аптека ""Новая""",43.1970188590284,76.8870742879665,"{'is_working': True, 'additional_info': []}",Алматы
117176,"мкр. Орбита-3, д. 1","ул. Торайгырова, уг. ул. Мустафина, столовая «Тагам», слева от входа, в тамбуре",43.2021,76.8782,"{'is_working': True, 'additional_info': []}",Алматы
41669,"мкр. Орбита-3, д. 31","ул. Торайгырова, уг. ул. Саина, аптека ""Садыхан""",43.2008,76.871,"{'is_working': True, 'additional_info': []}",Алматы
109192,"мкр. Орбита-3, д. 31",офис 16,43.2009,76.8717,"{'is_working': True, 'additional_info': []}",Алматы
41889,"мкр. Орбита-3, д. 4А","отделение ""Kaspi Bank""",43.2005,76.8793,"{'is_working': True, 'additional_info': []}",Алматы
109793,"мкр. Орбита-3, д. 5","рынок ""Орбита"", ТД Рената, слева от входа, напротив бутика женской косметики",43.1989072960931,76.8796084924003,"{'is_working': True, 'additional_info': []}",Алматы
112768,"мкр. Первомайский, ул. Капчагайская, д. 20 А","магазин ""Жібек Жолы""",43.3655,76.9453,"{'is_working': True, 'additional_info': []}",Алматы
41985,"мкр. Премьера, ул. Жуалы, д. 12","минимаркет ""ДАНИЯР""",43.2226,76.7946,"{'is_working': True, 'additional_info': []}",Алматы
112999,"мкр Самал-1, д. 6","магазин ""Папай""",43.2353,76.9576,"{'is_working': True, 'additional_info': []}",Алматы
113401,"мкр. Самал-2, бульвар Мендикулова, д. 105","напротив магазина ""Рамстор""",43.2333265973074,76.9528996650112,"{'is_working': True, 'additional_info': []}",Алматы
113011,"мкр. Самал-2, д. 111","ТРЦ DOSTYK PLAZA, магазин ""Sulpak"", cлева от входа",43.2337828743586,76.9567517175818,"{'is_working': True, 'additional_info': ['Не печатает чек']}",Алматы
112799,"мкр. Самал-2, д. 47",,43.2298191453195,76.9534409222658,"{'is_working': True, 'additional_info': []}",Алматы
42526,"мкр. Саялы-2, ул. Аркалык, д. 38","магазин ""АЛДИЯР""",43.3191,76.8418,"{'is_working': True, 'additional_info': []}",Алматы
41893,"мкр. Саялы, ул. Ак-Кайнар, д. 5","минимаркет ""Жаксылык"", напротив СШ №180",43.3114,76.8414,"{'is_working': True, 'additional_info': []}",Алматы
40917,"мкр. Саялы , ул. АККАЙНАР, д. 59","уг. ул. Вдоль БАКа, напротив СШ №180",43.312,76.8417,"{'is_working': True, 'additional_info': []}",Алматы
110498,"мкр. Тастак-2, д. 9","магазин ""АРА""",43.253016,76.867779,"{'is_working': True, 'additional_info': []}",Алматы
41798,"мкр. Тастыбулак, ул. Жандосова, д. 10 А","уг. ул. Мереке, минимаркет ""ДОС""",43.1848,76.826,"{'is_working': True, 'additional_info': []}",Алматы
41563,"мкр. Таугуль-3, ул. С.Шаймерденова, д. 19/1","возле гимназии №175, минимаркет ""Ai-Mart""",43.2001,76.8541,"{'is_working': True, 'additional_info': []}",Алматы
41622,"мкр. Таусамалы, д. 90 А","супермаркет ""Золоте Руно""",43.1876,76.8308,"{'is_working': True, 'additional_info': []}",Алматы
42645,"мкр. Таусамалы, ул. Ауэзова, д. 50","уг. ул. Яссауи, магазин ""Glomart"", возле АЗС ""Helios""",43.1983,76.8427,"{'is_working': True, 'additional_info': []}",Алматы
109082,"мкр. Таусамалы, ул. Рыскулова, д. 90 А","магазин ""Золотое Руно"", справа от входа, возле салона красоты",43.188885,76.829823,"{'is_working': True, 'additional_info': []}",Алматы
41292,"мкр. Трудовик, ул. Центральная, д. 110","магазин ""ZAKUP""",43.327,76.8496,"{'is_working': True, 'additional_info': []}",Алматы
110564,"мкр. Ужет, ул. Кошкарбаева, д. 236","уг. ул. Кожаберген жырау, магазин ""ЕЛАМАН""",43.3273,76.8974,"{'is_working': True, 'additional_info': []}",Алматы
112860,"мкр. Улжан-1, ул. Такежанова, д. 29",,43.2956078382877,76.8721356805734,"{'is_working': True, 'additional_info': []}",Алматы
112729,"мкр. Улжан, ул. Такежанова, д. 39Б","магазин ""Енель""",43.3041433336196,76.8742545873003,"{'is_working': True, 'additional_info': []}",Алматы
112935,"мкр. Шанырак-1, ул. Отемисулы, д. 127 А","уг. ул. Алпамыс, магазин ""Тамаша""",43.3006,76.8613,"{'is_working': True, 'additional_info': []}",Алматы
41581,"мкр. Шанырак-2, ул. Жанкожа батыра, д. 151","уг. ул. Каркара, минимаркет ""ШАНЫРАК""",43.2991,76.851,"{'is_working': True, 'additional_info': []}",Алматы
112749,"мкр. Шанырак-2, ул. Жанкожа батыра, д. 69",уг. ул. Балдырган,43.2911,76.8504,"{'is_working': True, 'additional_info': []}",Алматы
42518,"мкр. Шугыла, д. 341/3К2","магазин ""АДИЯ""",43.2139,76.7915,"{'is_working': True, 'additional_info': []}",Алматы
42407,"мкр. Шугыла, д. 341/5 К1","магазин ""Жибек""",43.2122,76.7916,"{'is_working': True, 'additional_info': []}",Алматы
41972,"мкр. Шугыла, д. 342","ЖК Шугыла, ул. Сабденова, уг. ул. Нурлы, магазин ""АСЫЛЖАН""",43.2144,76.7897,"{'is_working': True, 'additional_info': []}",Алматы
40427,"мкр. Шугыла, ул. Карабулак, д. 12/1",уг. ул. Проектировочной,43.224,76.7902,"{'is_working': True, 'additional_info': []}",Алматы
109890,"п. Боралдай, ул. Бостанова, д. 1","уг. ул. Аэродромная, напротив Боралдайского сахарного завода",43.35671,76.858729,"{'is_working': True, 'additional_info': []}",Боралдай
42531,"пос. Кыргауылды, ул. Бирлик, д. 1Е","АЗС ""Royal Petrol""",43.1708,76.7752,"{'is_working': True, 'additional_info': []}",Алматы
41709,"пр. Абая, д. 139","уг. ул. Жарокова, аптека ""Europharma""",43.2398,76.8978,"{'is_working': True, 'additional_info': []}",Алматы
109783,"пр. Абая, д. 141",уг. ул. Жарокова,43.239493767039,76.8961752023761,"{'is_working': True, 'additional_info': []}",Алматы
40621,"пр. Абая, д. 157 А",уг. ул. Розыбакиева,43.2391,76.8914,"{'is_working': True, 'additional_info': []}",Алматы
112928,"пр. Абая, д. 27а","станция метро ""Абай"", вход со стороны Аграрного университета",43.2425,76.9514,"{'is_working': True, 'additional_info': []}",Алматы
117337,"пр. Абая, д. 27А","ст. метро ""Абай"", вход со стороны Аграрного университета",43.2425,76.9514,"{'is_working': True, 'additional_info': []}",Алматы
41508,"пр. Абая, д. 30 А","уг. пр. Сейфуллина, кафе ""Аспандияр""",43.2411,76.9356,"{'is_working': True, 'additional_info': []}",Алматы
109737,"пр. Абая, д. 34/96",уг. ул. Масанчи,43.2411,76.9323,"{'is_working': True, 'additional_info': []}",Алматы
109692,"пр. Абая, д. 46",уг. ул. Шарипова,43.2405119382508,76.9232918759657,"{'is_working': True, 'additional_info': []}",Алматы
109680,"пр. Абая, д. 46",уг. ул. Шарипова,43.2405119382508,76.9232918759657,"{'is_working': True, 'additional_info': []}",Алматы
41782,"пр. Абая, д. 47","уг. пр. Абылай хана, минимаркет ""АЙ""",43.2425,76.9419,"{'is_working': True, 'additional_info': []}",Алматы
117170,"пр. Абая, д. 50","станция метро ""Драмтеатр им. Ауэзова"", вход со стороны театра",43.2407,76.9177,"{'is_working': True, 'additional_info': []}",Алматы
41819,"пр. Абая, д. 60","уг. ул. Манаса, аптека ""Europharma""",43.2395,76.9079,"{'is_working': True, 'additional_info': []}",Алматы
41645,"пр. Абая, д. 99","уг. ул. Шагабутдинова, аптека ""Аскорбинка""",43.2413,76.9218,"{'is_working': True, 'additional_info': []}",Алматы
109885,"пр. Абылай хана, д. 113",уг. ул. Богенбай батыра,43.252369,76.94131,"{'is_working': True, 'additional_info': []}",Алматы
109961,"пр. Абылай хана, д. 113",уг. ул. Богенбай батыра,43.252369,76.94131,"{'is_working': True, 'additional_info': []}",Алматы
112902,"пр. Абылай Хана, д. 131","уг. ул. Шевченко, магазин ""Алма-Ата""",43.2456,76.9423,"{'is_working': True, 'additional_info': []}",Алматы
112952,"пр. Абылай Хана, д. 3 А","ТД Алтын Тараз, справа от входа со стороны ул. Тузова",43.272816,76.93809,"{'is_working': True, 'additional_info': []}",Алматы
112906,"пр. Абылай Хана, д. 3 А","ТД Алтын Тараз, возле центрального входа",43.272816,76.93809,"{'is_working': True, 'additional_info': []}",Алматы
112634,"пр. Абылай хана, д. 60","уг. ул. Макатаева, БЦ Алматыгипрогор",43.2632187811422,76.9408098866575,"{'is_working': True, 'additional_info': []}",Алматы
40803,"пр. Абылай Хана, д. 62","ТЦ ЦУМ Зангар, 1 этаж, банкоматная зона",43.2626,76.9411,"{'is_working': True, 'additional_info': []}",Алматы
113415,"пр. Абылай хана, д. 68",уг. ул. Гоголя,43.260199,76.941329,"{'is_working': True, 'additional_info': []}",Алматы
109957,"пр. Абылай хана, д. 68",уг. ул. Гоголя,43.260199,76.941329,"{'is_working': True, 'additional_info': []}",Алматы
112852,"пр. Аль-Фараби, д. 110/19","уг. ул. Шашкина, магазин ""Раушан""",43.2212,76.9347,"{'is_working': True, 'additional_info': []}",Алматы
41820,"пр. Аль-Фараби, д. 13к1в","уг. ул. Желтоксан, БЦ НУРЛЫ-ТАУ, главный вход",43.2321,76.9447,"{'is_working': True, 'additional_info': []}",Алматы
41497,"пр. Аль-Фараби, д. 19/3 Б","уг. ул. Желтоксан, БЦ Нурлы Тау",43.2297,76.9457,"{'is_working': True, 'additional_info': []}",Алматы
112848,"пр. Аль-Фараби, д. 19, корпус 2Б","БЦ Нурлы-Тау, в холле, справа от входа",43.2293696336146,76.9457016822087,"{'is_working': True, 'additional_info': []}",Алматы
112842,"пр. Аль-Фараби, д. 7, корпус 1 А","БЦ Нурлы-Тау, в холле, прямо от входа",43.2302916715252,76.9465756210174,"{'is_working': True, 'additional_info': []}",Алматы
41289,"пр. Гагарина, д. 100","уг. пр. Абая, супермаркет ""АСАР""",43.2397,76.8951,"{'is_working': True, 'additional_info': []}",Алматы
112719,"пр. Гагарина, д. 155","выше. ул. Басенова, Аптека",43.2210120837979,76.8966768379576,"{'is_working': True, 'additional_info': []}",Алматы
112774,"пр. Достык, д. 105","уг. ул. Кажымукана, БЦ Премьер Алатау, в тамбуре, слева от входа",43.2255000158561,76.961054510908,"{'is_working': True, 'additional_info': []}",Алматы
110106,"пр. Достык, д. 248",уг. ул. Омаровой,43.2233082162,76.9630823545,"{'is_working': True, 'additional_info': []}",Алматы
110097,"пр. Достык, д. 248",уг. ул. Омаровой,43.2233082162,76.9630823545,"{'is_working': True, 'additional_info': []}",Алматы
41602,"пр. Достык, д. 71","уг. ул. Курмангазы, супермаркет ""Small""",43.2459,76.9562,"{'is_working': True, 'additional_info': []}",Алматы
112866,"пр. Достык, д. 91/1","выше ул. Жолдасбекова, Аптека",43.2324394785797,76.9587179992923,"{'is_working': True, 'additional_info': []}",Алматы
112803,"пр. Жибек Жолы, д. 111",Аэровокзал,43.2620460268286,76.9379319021089,"{'is_working': True, 'additional_info': []}",Алматы
42026,"пр. Жибек Жолы, д. 135","уг. ул. Масанчи, комплекс ""Жибек Жолы"", у главного входа, возле стойки ресепшн",43.2612,76.9293,"{'is_working': True, 'additional_info': []}",Алматы
41495,"пр. Жибек Жолы, д. 50/1а","уг. пр. Достык, ТД Квартал, аптека ""САДЫХАН""",43.2615,76.9549,"{'is_working': True, 'additional_info': []}",Алматы
110014,"пр. Жибек Жолы, д. 52","уг. ул. Пушкина, напротив Центрального рынка ""Зеленый базар""",43.2624584102,76.9549281938,"{'is_working': True, 'additional_info': []}",Алматы
109725,"пр. Жибек Жолы, д. 52","уг. ул. Пушкина, напротив Центрального рынка ""Зеленый базар""",43.2624584102,76.9549281938,"{'is_working': True, 'additional_info': []}",Алматы
110015,"пр. Жибек Жолы, д. 52","уг. ул. Пушкина, напротив Центрального рынка ""Зеленый базар""",43.2624584102,76.9549281938,"{'is_working': True, 'additional_info': []}",Алматы
109746,"пр. Жибек Жолы, д. 52","уг. ул. Пушкина, напротив Центрального рынка ""Зеленый базар""",43.2624584102,76.9549281938,"{'is_working': True, 'additional_info': []}",Алматы
42112,"пр. Назарбаева, д. 120","уг. ул. Богенбай батыра, магазин ""Диас""",43.2524,76.9476,"{'is_working': True, 'additional_info': []}",Алматы
41900,"пр. Назарбаева, д. 223","уг. ул. М.Ганди, ТРК АЛМА-АТА"", на входной группе со стороны пр. Назарбаева",43.2324,76.9492,"{'is_working': True, 'additional_info': []}",Алматы
42081,"пр. Назарбаева, д. 226","уг. ул. Жолдасбекова, ТЦ Ramstor All in, возле паркинга, банкоматная зона",43.2334,76.9509,"{'is_working': True, 'additional_info': []}",Алматы
109106,"пр. Назарбаева, д. 244А",,43.2248,76.9535,"{'is_working': True, 'additional_info': []}",Алматы
41642,"пр. Назарбаева, д. 58","пр. Аль-Фараби, магазин ""СУЛТАН""",43.2294,76.9511,"{'is_working': True, 'additional_info': []}",Алматы
42050,"пр. Назарбаева, д. 76","уг. ул. Гоголя, аптека ""Europharma""",43.2606,76.9464,"{'is_working': True, 'additional_info': []}",Алматы
112909,"пр. Райымбека, д. 100 А","уг. пр. Назарбаева, станция метро ""Райымбек батыр"", вход со стороны магазина ""Белый ветер""",43.2707,76.9453,"{'is_working': True, 'additional_info': []}",Алматы
112941,"пр. Райымбека, д. 100 А","уг. пр. Назарбаева, станция метро ""Райымбек батыр"", вход со стороны магазина ""Белый ветер""",43.2707,76.9453,"{'is_working': True, 'additional_info': []}",Алматы
112934,"пр. Райымбека, д. 100 А","уг. пр. Назарбаева, станция метро ""Райымбек батыр"", вход со стороны магазина ""Белый ветер""",43.2707,76.9453,"{'is_working': True, 'additional_info': []}",Алматы
112958,"пр. Райымбека, д. 101","уг. ул. Кунаева, Аптека, возле магазина ""Logy Com""",43.2709,76.9473,"{'is_working': True, 'additional_info': []}",Алматы
109972,"пр. Райымбека, д. 239 Г",ТРК MAXIMA,43.264507,76.899888,"{'is_working': True, 'additional_info': []}",Алматы
112982,"пр. Райымбека, д. 239 Г","ТРК MAXIMA, слева от главного входа, возле отделения ""Kaspi bank""",43.2642,76.8997,"{'is_working': True, 'additional_info': []}",Алматы
109747,"пр. Райымбека, д. 239 Г",ТРК MAXIMA,43.264507,76.899888,"{'is_working': True, 'additional_info': []}",Алматы
40672,"пр. Райымбека, д. 507А","уг. ул. Яссауи, супермаркет ""АРЗАН"", возле кассы №1-2, центральный вход",43.2417,76.8183,"{'is_working': True, 'additional_info': []}",Алматы
112667,"пр. Райымбека, д. 508/1","уг. ул. Саина, магазин ""Дана""",43.2459,76.8397,"{'is_working': True, 'additional_info': []}",Алматы
41924,"пр. Райымбека, д. 542/2","CТО ""G-Energy"", напротив АЗС ""Ros Petrol""",43.2375,76.8086,"{'is_working': True, 'additional_info': []}",Алматы
112904,"пр. Рыскулова, д. 103","уг. ул. Немировича-Данченко, ТД АЛАТАУ, возле 3-го входа со стороны пр. Рыскулова",43.2667237887216,76.8687644490786,"{'is_working': True, 'additional_info': []}",Алматы
42550,"пр. Рыскулова, д. 103/1А","уг. ул. Северное кольцо, строительный рынок ""САУРАН""",43.2732,76.8857,"{'is_working': True, 'additional_info': []}",Алматы
112992,"пр. Рыскулова, д. 111 А","магазин ""Продукты""",43.2586882325305,76.845697652906,"{'is_working': True, 'additional_info': []}",Алматы
112641,"пр. Рыскулова, д. 236","уг. ул. Ахременко, оптомаркет ""Сардар""",43.257874211851,76.8457512057055,"{'is_working': True, 'additional_info': []}",Алматы
41921,"пр. Рыскулова, д. 274А","уг. Саина, СТО ""SCT""",43.2551,76.841,"{'is_working': True, 'additional_info': []}",Алматы
110076,"пр. Сейфуллина, д. 168Б",уг. ул. Котельникова,43.30839,76.94006,"{'is_working': True, 'additional_info': []}",Алматы
41464,"пр. Сейфуллина, д. 16А","уг. ул. Молдагалиева, магазин ""Эльнас""",43.3331,76.9453,"{'is_working': True, 'additional_info': []}",Алматы
112781,"пр. Сейфуллина, д. 177/10 В","уг. ул. Акан Серы, Аптека",43.3073901483967,76.9392798437787,"{'is_working': True, 'additional_info': []}",Алматы
110162,"пр. Сейфуллина, д. 458",уг. ул. Гоголя,43.258203,76.93279,"{'is_working': True, 'additional_info': []}",Алматы
112619,"пр. Сейфуллина, д. 458-460/95","уг. ул. Айтеке би, БЦ Майсат, слева от входа  ",43.2582,76.9327,"{'is_working': True, 'additional_info': []}",Алматы
113038,"пр. Сейфуллина, д. 465","уг. пр. Райымбека, магазин ""ABDI"", 1 этаж, слева от главного входа, в банкаматной зоне",43.2702282532029,76.930287492754,"{'is_working': True, 'additional_info': []}",Алматы
40669,"пр. Сейфуллина, д. 472",уг. ул. Толе би,43.2546,76.9339,"{'is_working': True, 'additional_info': []}",Алматы
112763,"пр. Сейфуллина, д. 498","уг. ул. Богенбай батыра, БЦ Алтын Заман, слева от восточного входа",43.251506,76.933724,"{'is_working': True, 'additional_info': []}",Алматы
42142,"пр. Сейфуллина, д. 510","уг. ул. Жамбыла, аптека ""Europharma""",43.2477,76.9341,"{'is_working': True, 'additional_info': []}",Алматы
112794,"пр. Сейфуллина, д. 82","магазин ""Шахид""",43.317573515761,76.9397348984037,"{'is_working': True, 'additional_info': []}",Алматы
112673,"пр. Суюнбая, д. 199В","уг. ул. Кожедуба, супермаркет ""У рощи""",43.3093047934627,76.9560556159122,"{'is_working': True, 'additional_info': []}",Алматы
109298,"пр. Суюнбая, д. 2","ТК МЕРЕЙ, Гостиный двор, в тамбуре",43.2712,76.9495,"{'is_working': True, 'additional_info': []}",Алматы
41302,"пр. Суюнбая, д. 261","уг. ул. Хмельницкого, супермаркет ""Сабыржан"", на территории Ярмарки Турксиб",43.3227,76.9592,"{'is_working': True, 'additional_info': []}",Алматы
42011,"пр. Суюнбая, д. 2к9","гипермаркет ""КОМФОРТ"", главный вход",43.2754,76.9469,"{'is_working': True, 'additional_info': []}",Алматы
112812,"пр. Суюнбая, д. 2, корпус 9","магазин ""Sulpak"", возле зоны кредитования",43.2755,76.9481,"{'is_working': True, 'additional_info': []}",Алматы
113021,"пр. Суюнбая, д. 419 А","магазин ""HUSEINOFF"", вход со стороны ул. Бекмаханова, возле кассы",43.3462,76.9697,"{'is_working': True, 'additional_info': []}",Алматы
112827,"пр. Суюнбая, д. 569","магазин ""Нурлан"", 13 военный городок",43.3769,76.9935,"{'is_working': True, 'additional_info': []}",Алматы
42528,"Садовый бульвар, д. 1/10","уг. ул. Яссауи, АЗС ""Royal Petrol""",43.1969,76.8392,"{'is_working': True, 'additional_info': []}",Алматы
117307,"с. Байсерке, ул. Аркабая, д. 278","магазин-автомойка ""Ак Жан""",43.4945,77.0382,"{'is_working': True, 'additional_info': []}",Алматы
40972,"с. Байсерке, ул. Аркабая, д. 83 А",,43.4837,77.034,"{'is_working': True, 'additional_info': []}",Отеген батыр
113088,"с. Байсерке, ул. Аркабая, д. 85",ТД Береке,43.4841,77.0339,"{'is_working': True, 'additional_info': []}",Алматы
113101,"с. Байсерке, ул. Аркабая, д. 85","уг. ул. Школьная, супермаркет ""Береке""",43.4841,77.0339,"{'is_working': True, 'additional_info': []}",Отеген батыр
40995,"с. Булакты, ул. Ушконыр, д. 78/7","минимаркет ""Тамаша""",43.2071301494558,76.7452247427554,"{'is_working': True, 'additional_info': []}",Алматы
42609,"с. Жамбыл, ул. Жамбыла, д. 50",м/у улиц Сатбаева и Гаджиева,43.2692,76.6701,"{'is_working': True, 'additional_info': []}",Алматы
41038,"с. Иргели, трасса Алматы-Бишкек, 17КМ","ТРЦ APORT MALL, банкоматная зона, возле бутиков ""Frato2"" и ""Star88""",43.2349,76.7783,"{'is_working': True, 'additional_info': ['Не печатает чек']}",Алматы
41557,"с. КазЦик, ул. Сейдалиева, д. 72","ресторан ""Акку"", 1 этаж",43.381,76.8577,"{'is_working': True, 'additional_info': []}",Боралдай
41578,"с. Коксай, ул. Кожабекова, д. 9 А","уг. ул. Жас Улан, аптека ""от А до Я""",43.2577,76.7732,"{'is_working': True, 'additional_info': []}",Алматы
42679,"с. Чапаево, ул. Мира, д. 41","возле СШ №10, магазин ""Эдельвейс""",43.4747,76.807,"{'is_working': True, 'additional_info': []}",Алматы
41325,"Ташкентский тракт, 15 км","рынок ""Салем"", супермаркет ""Сабыржан""",43.2358,76.7701,"{'is_working': True, 'additional_info': []}",Алматы
42061,"Ташкентский тракт, д. 17к","отделение ""Kaspi Bank"", ТРЦ Aport Mall",43.2337,76.7778,"{'is_working': True, 'additional_info': []}",Алматы
42062,"Ташкентский тракт, д. 17к","отделение ""Kaspi Bank"", ТРЦ Aport Mall",43.2337,76.7778,"{'is_working': True, 'additional_info': []}",Алматы
109903,"ул. 6-я линия, д. 1/172","уг. ул. Ауэзова, напротив магазина Sulpak",43.2514200002,76.9007780761,"{'is_working': True, 'additional_info': []}",Алматы
