id,address1,address2,latitude,longitude,status,city
111766,"ул. Терешковой, д. 108","уг. Сарыкольской трассы, магазин ""Долина""",53.2156,63.7206,"{'is_working': True, 'additional_info': []}",Затобольск
41737,"ул. Терешковой, д. 13Б","магазин ""Карамель""",53.207782,63.709014,"{'is_working': True, 'additional_info': []}",Затобольск
40655,"ул. Терешковой, д. 46","уг. пр. Тауелсыздык, магазин ""Салем""",53.2074,63.7067,"{'is_working': True, 'additional_info': ['Не печатает чек']}",Затобольск
111697,"ул. Толстого, д. 50","уг. пр. Абая, Аптека №59, возле ЦУМа, справа от главного входа",53.2104,63.6356,"{'is_working': True, 'additional_info': []}",Костанай
42673,"ул. Уральская, д. 45","магазин ""Да-Ри-Бек"", район Аэропорта, новый микрорайон, на входе прямо",53.217856,63.570314,"{'is_working': True, 'additional_info': []}",Костанай
42611,"ул. Урожайная, д. 22","уг. ул. Кобланды Батыра, на входе справа",53.232654,63.662356,"{'is_working': True, 'additional_info': []}",Костанай
111656,"ул. Целинная, д. 2","магазин ""Норадуз"", р-н магазина ""Ыстык Нан""",53.204,63.6047,"{'is_working': True, 'additional_info': []}",Костанай
40688,"ул. Чернышевского, д. 68","супермаркет ""Rauzet"", справа от входа",53.2038,63.5922,"{'is_working': True, 'additional_info': []}",Костанай
111782,"ул. Чернышевского, д. 68Б","ТД Азия, вверх по лестнице в торговый зал, слева от входа, банкоматная зона",53.2036,63.5926,"{'is_working': True, 'additional_info': []}",Костанай
111741,"ул. Чернышевского, д. 68Б","ТД Азия, вверх по лестнице в торговый зал, слева от входа, банкоматная зона",53.2036,63.5927,"{'is_working': True, 'additional_info': []}",Костанай
42132,"ул. Чехова, д. 104","магазин ""Жагат"", уг. пр. Аль-Фараби",53.218675,63.624788,"{'is_working': True, 'additional_info': []}",Костанай
111627,"ул. Чкалова, д. 11","уг. ул. Арыстанбекова, ТД Два кума",53.182,63.5982,"{'is_working': True, 'additional_info': []}",Костанай
111767,"ул. Чкалова, д. 17","ТД Березка, слева от главного входа",53.1827,63.5945,"{'is_working': True, 'additional_info': []}",Костанай
110219,"ул. Чкалова, д. 2","магазин ""Жанна"", возле магазина ""Свет сити"", прямо от входа, между холодильниками",53.179,63.6141,"{'is_working': True, 'additional_info': []}",Костанай
111641,"ул. Шевченко, д. 37","рынок ""Береке"", возле отдела конфет",53.2211,63.6384,"{'is_working': True, 'additional_info': []}",Костанай
40610,"пр. Абая, д. 94","уг. ул. Л.Беды, магазин ""Филин"", р-н Наримановского рынка, напротив ТД БУМ, слева от главного входа, в продуктовом отделе",53.2005,63.6246,"{'is_working': False, 'additional_info': []}",Костанай
111755,"ул. Маяковского, д. 120","универсам ""Бахыт"", правый вход, в ряду терминалов",53.1771,63.608,"{'is_working': False, 'additional_info': []}",Костанай
110202,"9 мкр-н, д. 1, ВП 7","ул. Воинов-Интернационалистов, ост. ""15 магазин""",53.1859924448,63.6003762024,"{'is_working': False, 'additional_info': []}",Костанай
